{
  "$schema": "https://json-schema.org/draft/2020-12/schema",
  "title": "KMatch 独立题目库 Question Schema",
  "description": "questions/ 目录下每节点题目文件的格式规范。运行时由学情检测Agent从 Neo4j :Question 节点抽题（经 :HAS_QUESTION 关联）。每文件3题，共92文件276题。",
  "type": "array",
  "minItems": 1,
  "maxItems": 10,
  "items": {
    "type": "object",
    "required": ["qid", "source_node_id", "type", "question", "answer", "difficulty"],
    "properties": {
      "qid": {
        "type": "string",
        "pattern": "^Q-[A-Z]{2}\\d{3}-\\d{3}$",
        "description": "题目全局唯一ID，格式 Q-{节点ID}-{序号}，如 Q-PY001-001"
      },
      "source_node_id": {
        "type": "string",
        "pattern": "^[A-Z]{2}-\\d{3}$",
        "description": "出题知识点节点ID，导入Neo4j后同时设置node_id"
      },
      "node_id": {
        "type": "string",
        "pattern": "^[A-Z]{2}-\\d{3}$",
        "description": "冗余字段，与source_node_id相同，供Cypher索引加速"
      },
      "type": {
        "type": "string",
        "enum": ["choice", "fill", "code"],
        "description": "题型：choice=选择题(精确判分), fill=填空题(LLM语义判分), code=代码题(沙箱执行判分)"
      },
      "question": {
        "type": "string",
        "minLength": 5,
        "description": "题目描述/题干"
      },
      "options": {
        "type": "array",
        "items": { "type": "string" },
        "minItems": 2,
        "maxItems": 6,
        "description": "选项列表，仅choice题型必填。如 ['A. ...', 'B. ...']"
      },
      "answer": {
        "type": "string",
        "description": "正确答案。choice题=选项字母(如'C'), fill题=关键词(如'type'), code题=完整代码"
      },
      "difficulty": {
        "type": "integer",
        "minimum": 1,
        "maximum": 5,
        "description": "本题难度 1-5，与知识点难度独立（可略高或略低于节点难度）"
      },
      "hint": {
        "type": "string",
        "description": "可选提示，引导学生思考方向"
      },
      "explanation": {
        "type": "string",
        "description": "完整解释，含干扰项分析。LLM出题时生成（对齐层次1减幻觉），code题可留空"
      }
    },
    "allOf": [
      {
        "if": {
          "properties": { "type": { "const": "choice" } }
        },
        "then": {
          "required": ["options"]
        }
      }
    ],
    "additionalProperties": false
  }
}
