[
  {
    "type": "choice",
    "question": "关于scikit-learn中Pipeline和机器学习工作流的描述，以下哪个选项是正确的？",
    "options": [
      "A. 在Pipeline中，无需使用ColumnTransformer就能对不同列应用不同的预处理",
      "B. 在train_test_split之前对整个数据集进行标准化是安全的，不会造成数据泄露",
      "C. cross_val_score可以直接用于超参数搜索，不需要GridSearchCV",
      "D. 使用joblib.dump保存模型时，建议保存整个Pipeline以确保预测时的数据预处理一致"
    ],
    "answer": "D",
    "difficulty": 4,
    "hint": "考虑数据泄露防范和模型部署的完整性。",
    "explanation": "A错误，需要使用ColumnTransformer对不同列应用不同预处理；B错误，先标准化再划分会导致测试集信息泄露到训练集；C错误，cross_val_score仅用于评估，超参数搜索需GridSearchCV或RandomizedSearchCV；D正确，保存整个Pipeline可保证预测时预处理一致。",
    "qid": "Q-PY086-001",
    "source_node_id": "PY-086",
    "node_id": "PY-086"
  },
  {
    "type": "fill",
    "question": "使用scikit-learn进行交叉验证评估模型性能时，常用的函数是______。",
    "answer": "cross_val_score",
    "difficulty": 4,
    "hint": "该函数位于sklearn.model_selection模块。",
    "explanation": "cross_val_score能够方便地对指定模型和数据集进行k折交叉验证，返回每折的评分。",
    "qid": "Q-PY086-002",
    "source_node_id": "PY-086",
    "node_id": "PY-086"
  },
  {
    "type": "code",
    "question": "编写一个完整的机器学习脚本：使用scikit-learn构建流水线，对含有数值列'age'、'salary'和类别列'city'、'department'的数据集进行预处理（数值列标准化，类别列独热编码），然后使用随机森林分类器进行训练。要求：1) 使用ColumnTransformer和Pipeline；2) 使用train_test_split划分数据；3) 使用cross_val_score评估流水线性能；4) 使用GridSearchCV对随机森林的n_estimators和max_depth进行调优；5) 用joblib保存最佳模型。假设数据集已加载为DataFrame df，特征列为['age','salary','city','department']，目标列为'target'。请提供完整Python代码。",
    "answer": "import pandas as pd\nfrom sklearn.model_selection import train_test_split, cross_val_score, GridSearchCV\nfrom sklearn.preprocessing import StandardScaler, OneHotEncoder\nfrom sklearn.compose import ColumnTransformer\nfrom sklearn.pipeline import Pipeline\nfrom sklearn.ensemble import RandomForestClassifier\nimport joblib\n\n# 假设 df 已存在\nX = df[['age','salary','city','department']]\ny = df['target']\n\n# 定义数值和类别列\nnumeric_features = ['age', 'salary']\ncategorical_features = ['city', 'department']\n\n# 构建ColumnTransformer\npreprocessor = ColumnTransformer(\n    transformers=[\n        ('num', StandardScaler(), numeric_features),\n        ('cat', OneHotEncoder(), categorical_features)\n    ])\n\n# 构建Pipeline\npipeline = Pipeline(steps=[\n    ('preprocessor', preprocessor),\n    ('classifier', RandomForestClassifier(random_state=42))\n])\n\n# 划分数据集\nX_train, X_test, y_train, y_test = train_test_split(X, y, test_size=0.2, random_state=42)\n\n# 交叉验证评估\ncv_scores = cross_val_score(pipeline, X_train, y_train, cv=5)\nprint('交叉验证平均准确率:', cv_scores.mean())\n\n# 超参数网格搜索\nparam_grid = {\n    'classifier__n_estimators': [50, 100, 200],\n    'classifier__max_depth': [None, 10, 20]\n}\ngrid_search = GridSearchCV(pipeline, param_grid, cv=5, scoring='accuracy')\ngrid_search.fit(X_train, y_train)\n\n# 最佳模型\nbest_model = grid_search.best_estimator_\nprint('最佳参数:', grid_search.best_params_)\nprint('测试集准确率:', best_model.score(X_test, y_test))\n\n# 保存模型\njoblib.dump(best_model, 'best_pipeline_model.pkl')\nprint('模型已保存')",
    "difficulty": 5,
    "hint": "注意在GridSearchCV中参数名称格式：'step__parameter'，如'classifier__n_estimators'。",
    "explanation": "代码完整实现了要求的五个步骤：ColumnTransformer用于混合预处理，Pipeline集成预处理和分类器，train_test_split划分数据，cross_val_score初步评估，GridSearchCV搜索超参数，joblib保存整个Pipeline。使用'step__param'双下划线方式指定嵌套参数。",
    "qid": "Q-PY086-003",
    "source_node_id": "PY-086",
    "node_id": "PY-086"
  }
]
