[
  {
    "type": "choice",
    "question": "关于 FastAPI 的说法，下列哪一项是正确的？",
    "options": [
      "A. FastAPI 中的查询参数和路径参数都是用相同的语法声明，没有区别。",
      "B. 使用 Pydantic BaseModel 定义的模型只能用作请求体，不能用于响应模型。",
      "C. FastAPI 需要额外配置才能启用自动生成的 Swagger UI 文档。",
      "D. 路径参数使用特殊语法在路由中定义，查询参数则直接作为函数参数声明，FastAPI 通过类型注解自动区分。"
    ],
    "answer": "D",
    "difficulty": 2,
    "hint": "路径参数是路径的一部分，用花括号占位，查询参数是?key=value形式。",
    "explanation": "选项A错误，因为查询参数和路径参数声明方式不同；选项B错误，Pydantic模型既可用作请求体也可用作响应模型；选项C错误，FastAPI自动生成Swagger UI(/docs)和ReDoc，无需额外配置；选项D正确描述了FastAPI通过路径中的{param}和函数参数声明区分路径参数与查询参数的方式。",
    "qid": "Q-PY072-001",
    "source_node_id": "PY-072",
    "node_id": "PY-072"
  },
  {
    "type": "fill",
    "question": "在 FastAPI 中，若要将一个可调用对象作为依赖项注入到路径操作函数中，可以使用名为 _____ 的函数。",
    "answer": "Depends",
    "difficulty": 2,
    "hint": "导入自 fastapi 包。",
    "explanation": "FastAPI 提供 Depends 用于依赖注入，在函数参数默认值中使用 Depends(dependency_func) 即可。",
    "qid": "Q-PY072-002",
    "source_node_id": "PY-072",
    "node_id": "PY-072"
  },
  {
    "type": "code",
    "question": "编写一个 FastAPI 应用，实现以下端点：\n- POST /items/{item_id}，路径参数 item_id 为 int，查询参数 q 为可选字符串(默认None)，请求体为 Item 模型(包含 name: str 和 price: float)。\n- 使用依赖注入从请求头 X-API-Key 中获取 API 密钥，若值不为 'secret' 则返回 403 状态码。\n- 添加后台任务，该任务打印 \"Item created: {item_id}\"。\n- 返回 JSON 包含 item_id, q, item 的信息。\n写出完整的 Python 代码（包括必要的 import）。",
    "answer": "from fastapi import FastAPI, Header, BackgroundTasks, Depends, HTTPException\nfrom pydantic import BaseModel\n\napp = FastAPI()\n\nclass Item(BaseModel):\n    name: str\n    price: float\n\ndef verify_api_key(x_api_key: str = Header(...)):\n    if x_api_key != \"secret\":\n        raise HTTPException(status_code=403, detail=\"Invalid API Key\")\n    return x_api_key\n\n@app.post(\"/items/{item_id}\")\nasync def create_item(item_id: int, item: Item, q: str = None, background_tasks: BackgroundTasks = BackgroundTasks(), api_key: str = Depends(verify_api_key)):\n    background_tasks.add_task(lambda: print(f\"Item created: {item_id}\"))\n    return {\"item_id\": item_id, \"q\": q, \"item\": item}\n",
    "difficulty": 4,
    "hint": "使用 fastapi.BackgroundTasks 和 fastapi.Depends，Header 用于获取请求头。",
    "explanation": "本题综合考察了路径参数、查询参数、Pydantic 请求体、依赖注入（Depends + Header）、后台任务等多个 FastAPI 核心特性。代码中通过 verify_api_key 函数依赖获取 X-API-Key 并验证，通过 BackgroundTasks 添加后台任务，正确返回 JSON 响应。",
    "qid": "Q-PY072-003",
    "source_node_id": "PY-072",
    "node_id": "PY-072"
  }
]
