[
  {
    "type": "choice",
    "question": "以下关于排序算法的说法中，正确的是？",
    "options": [
      "A. 冒泡排序每一轮都将未排序部分的最小元素放到最前面",
      "B. 选择排序通过不断比较并交换相邻元素来将最小元素移到前面",
      "C. 插入排序对于已经有序的数组，时间复杂度仍然是 O(n²)",
      "D. 这三种排序算法都是原地排序"
    ],
    "answer": "D",
    "difficulty": 2,
    "hint": "回忆冒泡、选择和插入排序的核心操作与空间特性。",
    "explanation": "冒泡排序每轮将当前未排序部分的最大元素浮到最后，而非最小元素。选择排序每轮选出最小元素然后交换到前端，不是通过相邻交换。插入排序在数组已有序时只需 n-1 次比较，时间复杂度为 O(n)。冒泡、选择、插入排序都直接在原数组上操作，不需要额外数组空间，因此都是原地排序。",
    "qid": "Q-PY024-001",
    "source_node_id": "PY-024",
    "node_id": "PY-024"
  },
  {
    "type": "choice",
    "question": "关于简单排序算法的描述，正确的是？",
    "options": [
      "A. 冒泡排序每一轮都将未排序部分的最小元素放到最前面",
      "B. 选择排序通过不断比较并交换相邻元素来将最小元素移到前面",
      "C. 插入排序在处理接近有序的数据时速度最快",
      "D. 这三种排序算法都需要借助额外的数组空间，因此不是原地排序"
    ],
    "answer": "C",
    "difficulty": 2,
    "hint": "重点比较插入排序与其他两种在数据接近有序时的表现。",
    "explanation": "插入排序在数据接近有序时，内层循环能快速终止，复杂度接近 O(n)，是三种简单排序里对此类数据最快的。冒泡排序每轮是把最大元素交换到末尾，选择排序是直接选取最小元素后交换一次，不是相邻交换；这三种排序都是原地排序，无需额外数组。",
    "qid": "Q-PY024-002",
    "source_node_id": "PY-024",
    "node_id": "PY-024"
  },
  {
    "type": "fill",
    "question": "插入排序对于已经有序的数组，时间复杂度为______。",
    "answer": "O(n)",
    "difficulty": 2,
    "hint": "考虑已有序情况下内层循环的检查次数。",
    "explanation": "在数组已经有序时，插入排序每轮只需比较一次即可确定插入位置，总共进行 n-1 次比较，没有元素交换，时间复杂度为 O(n)。",
    "qid": "Q-PY024-003",
    "source_node_id": "PY-024",
    "node_id": "PY-024"
  }
]
